claim,status,basis,recommended_wording
Random row-wise validation overestimates performance for unseen publications.,Permitted,"Positive continuous validation gaps, robust Step 17 sensitivities, and concordant Step 18 classification gaps.",Random row-wise validation materially overestimated cross-publication performance under the tested pipelines.
The model memorizes publication identity.,Use cautiously,"A validation gap supports source dependence, but the term memorization requires direct source-identification and permutation evidence from the earlier diagnostic steps.",The results are consistent with substantial source dependence and publication-specific structure.
The random-intercept model improves prediction for new publications.,Not permitted,Grouped conditional and marginal predictions were identical; source-specific offsets are unavailable for unseen sources.,Random-intercept correction did not improve prediction for completely unseen publications.
The random-intercept correction can improve prediction for represented publications.,Permitted with outcome-specific effect sizes,"Random-rowwise conditional-vs-matched contrasts favored the conditional model, particularly for filament diameter.","Conditional correction improved within-source extension, but the magnitude was outcome dependent."
The SHAP-ranked variables are causal drivers.,Not permitted,"SHAP values quantify model attribution in observational, literature-derived data.",The variables showed stable predictive associations across publication-grouped folds and bootstrap samples.
Cross-publication prediction is uniformly impossible.,Not permitted,"Cell-viability grouped performance was approximately null, whereas filament diameter retained limited positive grouped R2.",Transfer was outcome dependent and substantially weaker than random-split estimates.
